[
  {
    "dealId": "0192f0c8-3c4e-7a2b-8c3d-4e5f6a7b8c9d",
    "state": "FUNDED",
    "network": "testnet",
    "identityPolicy": "zk-or-chip",
    "amountDrops": "250000000",
    "payoutA": "r3sNTMefq5gsRumMYsNznnX6yzzxVH6dTC",
    "payoutB": "rPPdduC9MRTrXZP1J7MQyEKKEYiFigWZ6Q:12345",
    "lawyerOpsA": "rHhr2iRBgp3ZzzNH4YGQ59G7VAiGPEWj7f",
    "lawyerOpsB": "rEhh6f9rj5UUBhFzGGaxS5zYU2CCqKFXBC",
    "contractRoot": "0101010101010101010101010101010101010101010101010101010101010101",
    "walletAddress": "rH9ESAdrFfDAZtCZGa7JiwNJfKnC6CmGFQ",
    "signedContractSeal": "0202020202020202020202020202020202020202020202020202020202020202",
    "dealSeal": "0f0f0f0f0f0f0f0f0f0f0f0f0f0f0f0f0f0f0f0f0f0f0f0f0f0f0f0f0f0f0f0f",
    "nftTokenId": "0A0A0A0A0A0A0A0A0A0A0A0A0A0A0A0A0A0A0A0A0A0A0A0A0A0A0A0A0A0A0A0A",
    "mintTxHash": "1B1B1B1B1B1B1B1B1B1B1B1B1B1B1B1B1B1B1B1B1B1B1B1B1B1B1B1B1B1B1B1B",
    "escrow": {
      "owner": "r3sNTMefq5gsRumMYsNznnX6yzzxVH6dTC",
      "offer_sequence": 7,
      "amount_drops": "250000000",
      "condition": "A02580206666666666666666666666666666666666666666666666666666666666666666810120",
      "cancel_after": 815000000
    },
    "exitSlot": 9
  }
]
